<?xml version="1.0" encoding="UTF-8"?>
<xs:schema xmlns:xs="http://www.w3.org/2001/XMLSchema">
    <xs:element name="subject">
        <xs:complexType>
            <xs:sequence>

                <xs:element name="name" type="xs:string"/>
                <xs:element name="academic_year">
                    <xs:simpleType>
                        <xs:restriction base="xs:integer">
                            <xs:minInclusive value="1000"/>
                            <xs:maxInclusive value="2026"/>
                        </xs:restriction>
                    </xs:simpleType>
                </xs:element>
                <xs:element name="ects">
                    <xs:simpleType>
                        <xs:restriction base="xs:integer">
                            <xs:minInclusive value="4"/>
                            <xs:maxInclusive value="30"/>
                        </xs:restriction>
                    </xs:simpleType>
                </xs:element>

                <xs:element name="evaluation_methods">
                    <xs:complexType>
                        <xs:sequence>
                            <xs:element name="evaluation_method" maxOccurs="unbounded">
                                <xs:complexType>
                                    <xs:sequence>

                                        <xs:element name="evaluation_element" maxOccurs="unbounded">
                                            <xs:complexType>
                                                <xs:sequence>
                                                    <xs:element name="name" type="xs:string"/>
                                                </xs:sequence>

                                                <xs:attribute name="id" type="xs:ID" use="required"/>

                                                <xs:attribute name="weight" use="required">
                                                    <xs:simpleType>
                                                        <xs:restriction base="xs:decimal">
                                                            <xs:minInclusive value="0"/>
                                                            <xs:maxInclusive value="100"/>
                                                        </xs:restriction>
                                                    </xs:simpleType>
                                                </xs:attribute>

                                            </xs:complexType>
                                        </xs:element>

                                    </xs:sequence>

                                    <xs:attribute name="id" type="xs:ID" use="required"/>

                                    <xs:attribute name="type" use="required">
                                        <xs:simpleType>
                                            <xs:restriction base="xs:string">
                                                <xs:enumeration value="continuous"/>
                                                <xs:enumeration value="exam"/>
                                            </xs:restriction>
                                        </xs:simpleType>
                                    </xs:attribute>

                                </xs:complexType>
                            </xs:element>
                        </xs:sequence>
                    </xs:complexType>
                </xs:element>

                <xs:element name="students">
                    <xs:complexType>
                        <xs:sequence>

                            <xs:element name="student" maxOccurs="unbounded">
                                <xs:complexType>
                                    <xs:sequence>

                                        <xs:element name="number" type="xs:integer"/>
                                        <xs:element name="name" type="xs:string"/>

                                        <xs:element name="grades">
                                            <xs:complexType>
                                                <xs:sequence>

                                                    <xs:element name="grade" maxOccurs="unbounded">
                                                        <xs:complexType>

                                                            <xs:attribute name="element_ref"
                                                                          type="xs:IDREF"
                                                                          use="required"/>

                                                            <xs:attribute name="value"
                                                                          use="required">
                                                                <xs:simpleType>
                                                                    <xs:restriction base="xs:decimal">
                                                                        <xs:minInclusive value="0"/>
                                                                        <xs:maxInclusive value="20"/>
                                                                    </xs:restriction>
                                                                </xs:simpleType>
                                                            </xs:attribute>

                                                        </xs:complexType>
                                                    </xs:element>

                                                </xs:sequence>
                                            </xs:complexType>
                                        </xs:element>

                                    </xs:sequence>
                                </xs:complexType>
                            </xs:element>

                        </xs:sequence>
                    </xs:complexType>
                </xs:element>

            </xs:sequence>
        </xs:complexType>
    </xs:element>
</xs:schema>